{
  "uats_version": "1.0.0",
  "api": {
    "name": "Distribution Stats",
    "base_url": "http://localhost:8082",
    "version": "v1",
    "service": "mdemg",
    "tags": [
      "memory",
      "stats",
      "read"
    ]
  },
  "metadata": {
    "author": "reh3376",
    "created": "2026-01-29",
    "description": "Validates Distribution Stats endpoint",
    "test_type": "contract",
    "priority": "medium"
  },
  "config": {
    "timeout_ms": 15000,
    "sha256": "b5dfc9ecf04499ddf25a14682a4035e476fa175eafbd0050b04df25c07646fcf"
  },
  "variables": {
    "test_space": "demo"
  },
  "request": {
    "method": "GET",
    "path": "/v1/memory/distribution",
    "query": {
      "space_id": "{{test_space}}"
    }
  },
  "expected": {
    "status": 200,
    "body_assertions": [
      {
        "path": "$.stats.space_id",
        "type": "string"
      },
      {
        "path": "$.stats.edge_count",
        "type": "integer"
      },
      {
        "path": "$.stats.phase",
        "type": "string"
      },
      {
        "path": "$.stats.phase_thresholds",
        "type": "object"
      },
      {
        "path": "$.history",
        "type": "array"
      }
    ]
  }
}
