{
  "uats_version": "1.0.0",
  "api": {
    "name": "List Scrape Jobs",
    "base_url": "${MDEMG_BASE_URL}",
    "version": "v1",
    "service": "mdemg",
    "tags": [
      "scraper",
      "list",
      "read"
    ]
  },
  "metadata": {
    "author": "reh3376",
    "created": "2026-02-07",
    "description": "Validates GET /v1/scraper/jobs returns list of scraping jobs (Phase 51)",
    "test_type": "contract",
    "priority": "medium"
  },
  "config": {
    "timeout_ms": 15000,
    "sha256": "34aed6d693e6fef527f81e574242391eee7e3c5a14c4366ebb3b385062a9264e"
  },
  "variables": {},
  "request": {
    "method": "GET",
    "path": "/v1/scraper/jobs",
    "headers": {
      "Content-Type": "application/json"
    }
  },
  "expected": {
    "status": 503,
    "body_assertions": [
      {
        "path": "$.error",
        "type": "string"
      }
    ]
  }
}
