{
  "uats_version": "1.0.0",
  "api": {
    "name": "APE Status",
    "base_url": "${MDEMG_BASE_URL}",
    "version": "v1",
    "service": "mdemg",
    "tags": [
      "system",
      "ape",
      "read"
    ]
  },
  "metadata": {
    "author": "reh3376",
    "created": "2026-01-29",
    "description": "Validates APE Status endpoint",
    "test_type": "contract",
    "priority": "medium"
  },
  "config": {
    "timeout_ms": 15000,
    "sha256": "353ff3f5e696def07ac1a07c341c0772385d995934c853c57c0b36078ec96a0d"
  },
  "variables": {
    "test_space": "demo"
  },
  "request": {
    "method": "GET",
    "path": "/v1/ape/status"
  },
  "expected": {
    "status": 200,
    "body_assertions": [
      {
        "path": "$.data.enabled",
        "type": "boolean"
      },
      {
        "path": "$.data.modules",
        "type": "array"
      }
    ]
  }
}
