{
  "uats_version": "1.0.0",
  "api": {
    "name": "Unfreeze Learning",
    "base_url": "http://localhost:8082",
    "version": "v1",
    "service": "mdemg",
    "tags": [
      "learning",
      "unfreeze",
      "write"
    ]
  },
  "metadata": {
    "author": "reh3376",
    "created": "2026-01-29",
    "description": "Validates Unfreeze Learning endpoint",
    "test_type": "contract",
    "priority": "medium"
  },
  "config": {
    "timeout_ms": 15000
  },
  "variables": {
    "test_space": "demo"
  },
  "request": {
    "method": "POST",
    "path": "/v1/learning/unfreeze",
    "body": {
      "space_id": "{{test_space}}"
    },
    "headers": {
      "Content-Type": "application/json"
    }
  },
  "expected": {
    "status": 200,
    "body_assertions": [
      {
        "path": "$.frozen",
        "type": "boolean"
      }
    ]
  }
}