{
  "uats_version": "1.0.0",
  "api": {
    "name": "Delete Backup",
    "base_url": "${MDEMG_BASE_URL}",
    "version": "v1",
    "service": "mdemg",
    "tags": [
      "backup",
      "delete",
      "write"
    ]
  },
  "metadata": {
    "author": "reh3376",
    "created": "2026-02-07",
    "description": "Validates DELETE /v1/backup/{id} returns 404 for nonexistent backup",
    "test_type": "contract",
    "priority": "medium"
  },
  "config": {
    "timeout_ms": 10000,
    "sha256": "3bd9167e7c499e09b3f7de79b03803a621e7327694859b2aae25bd1ef3ca0132"
  },
  "variables": {},
  "request": {
    "method": "DELETE",
    "path": "/v1/backup/nonexistent-backup-id",
    "headers": {
      "Content-Type": "application/json"
    }
  },
  "expected": {
    "status": 404,
    "body_assertions": [
      {
        "path": "$.error",
        "type": "string"
      }
    ]
  }
}
