{
  "uats_version": "1.0.0",
  "api": {
    "name": "Learning Stats",
    "base_url": "http://localhost:8082",
    "version": "v1",
    "service": "mdemg",
    "tags": [
      "learning",
      "stats",
      "read"
    ]
  },
  "metadata": {
    "author": "reh3376",
    "created": "2026-01-29",
    "description": "Validates Learning Stats endpoint",
    "test_type": "contract",
    "priority": "medium"
  },
  "config": {
    "timeout_ms": 15000
  },
  "variables": {
    "test_space": "demo"
  },
  "request": {
    "method": "GET",
    "path": "/v1/learning/stats",
    "query": {
      "space_id": "{{test_space}}"
    }
  },
  "expected": {
    "status": 200,
    "body_assertions": []
  }
}