{
  "uats_version": "1.0.0",
  "api": {
    "name": "Submit Feedback",
    "base_url": "http://localhost:8082",
    "version": "v1",
    "service": "mdemg",
    "tags": [
      "system",
      "feedback",
      "write"
    ]
  },
  "metadata": {
    "author": "reh3376",
    "created": "2026-01-29",
    "description": "Validates Submit Feedback endpoint",
    "test_type": "contract",
    "priority": "medium"
  },
  "config": {
    "timeout_ms": 15000
  },
  "variables": {
    "test_space": "demo"
  },
  "request": {
    "method": "POST",
    "path": "/v1/feedback",
    "body": {
      "space_id": "{{test_space}}",
      "type": "positive",
      "context": "UATS test feedback"
    },
    "headers": {
      "Content-Type": "application/json"
    }
  },
  "expected": {
    "status": [
      200,
      201
    ],
    "body_assertions": []
  }
}