{
  "uats_version": "1.0.0",
  "api": {
    "name": "Phase 88 - Self-Improve Rollback List",
    "base_url": "${MDEMG_BASE_URL}",
    "version": "v1",
    "service": "mdemg",
    "tags": [
      "rsic",
      "phase88",
      "safety",
      "rollback"
    ]
  },
  "metadata": {
    "author": "reh3376",
    "created": "2026-02-16",
    "description": "Validates GET /v1/self-improve/rollback returns snapshot listing with correct shape.",
    "test_type": "contract",
    "priority": "high"
  },
  "config": {
    "timeout_ms": 5000,
    "sha256": "2c0e47e9708a1ca8c817f7d9fb0bf233e42c1caddacb866ed9017d646b9713cb"
  },
  "request": {
    "method": "GET",
    "path": "/v1/self-improve/rollback"
  },
  "expected": {
    "status": 200,
    "body_assertions": [
      {
        "path": "$.snapshots",
        "type": "array"
      },
      {
        "path": "$.count",
        "type": "number"
      },
      {
        "path": "$.rollback_window_sec",
        "type": "number"
      }
    ]
  }
}
