{
  "uats_version": "1.0.0",
  "api": {
    "name": "Capability Gaps",
    "base_url": "${MDEMG_BASE_URL}",
    "version": "v1",
    "service": "mdemg",
    "tags": [
      "system",
      "gaps",
      "read"
    ]
  },
  "metadata": {
    "author": "reh3376",
    "created": "2026-01-29",
    "description": "Validates Capability Gaps endpoint",
    "test_type": "contract",
    "priority": "medium"
  },
  "config": {
    "timeout_ms": 15000,
    "sha256": "ecac159d197e2b31764f458514d304a3894679c83cbb9cc5422905e2a32e8c49"
  },
  "variables": {
    "test_space": "demo"
  },
  "request": {
    "method": "GET",
    "path": "/v1/system/capability-gaps",
    "query": {
      "space_id": "{{test_space}}"
    }
  },
  "expected": {
    "status": 200,
    "body_assertions": [
      {
        "path": "$.data.gaps",
        "type": "array"
      },
      {
        "path": "$.data.summary",
        "type": "object"
      }
    ]
  }
}
